[
  {
    "id": "iit-kharagpur",
    "name": "Indian Institute of Technology Kharagpur",
    "aliases": ["IIT Kharagpur", "IIT, Kharagpur", "IITKGP"],
    "type": "IIT",
    "state": "West Bengal",
    "city": "Kharagpur",
    "established": 1951,
    "nirf_rank": 5
  },
  {
    "id": "iit-bombay",
    "name": "Indian Institute of Technology Bombay",
    "aliases": ["IIT Bombay", "IIT, Bombay", "IIT Mumbai", "IITB"],
    "type": "IIT",
    "state": "Maharashtra",
    "city": "Mumbai",
    "established": 1958,
    "nirf_rank": 3
  },
  {
    "id": "iit-madras",
    "name": "Indian Institute of Technology Madras",
    "aliases": ["IIT Madras", "IIT, Madras", "IIT Chennai", "IITM"],
    "type": "IIT",
    "state": "Tamil Nadu",
    "city": "Chennai",
    "established": 1959,
    "nirf_rank": 1
  },
  {
    "id": "iit-kanpur",
    "name": "Indian Institute of Technology Kanpur",
    "aliases": ["IIT Kanpur", "IIT, Kanpur", "IITK"],
    "type": "IIT",
    "state": "Uttar Pradesh",
    "city": "Kanpur",
    "established": 1959,
    "nirf_rank": 4
  },
  {
    "id": "iit-delhi",
    "name": "Indian Institute of Technology Delhi",
    "aliases": ["IIT Delhi", "IIT, Delhi", "IITD"],
    "type": "IIT",
    "state": "Delhi",
    "city": "New Delhi",
    "established": 1961,
    "nirf_rank": 2
  },
  {
    "id": "iit-guwahati",
    "name": "Indian Institute of Technology Guwahati",
    "aliases": ["IIT Guwahati", "IIT, Guwahati", "IITG"],
    "type": "IIT",
    "state": "Assam",
    "city": "Guwahati",
    "established": 1994,
    "nirf_rank": 7
  },
  {
    "id": "iit-roorkee",
    "name": "Indian Institute of Technology Roorkee",
    "aliases": ["IIT Roorkee", "IIT, Roorkee", "IITR"],
    "type": "IIT",
    "state": "Uttarakhand",
    "city": "Roorkee",
    "established": 2001,
    "nirf_rank": 6
  },
  {
    "id": "iit-bhubaneswar",
    "name": "Indian Institute of Technology Bhubaneswar",
    "aliases": ["IIT Bhubaneswar", "IIT, Bhubaneswar", "IITBBS"],
    "type": "IIT",
    "state": "Odisha",
    "city": "Bhubaneswar",
    "established": 2008,
    "nirf_rank": 28
  },
  {
    "id": "iit-gandhinagar",
    "name": "Indian Institute of Technology Gandhinagar",
    "aliases": ["IIT Gandhinagar", "IIT, Gandhinagar", "IITGN"],
    "type": "IIT",
    "state": "Gujarat",
    "city": "Gandhinagar",
    "established": 2008,
    "nirf_rank": 16
  },
  {
    "id": "iit-hyderabad",
    "name": "Indian Institute of Technology Hyderabad",
    "aliases": ["IIT Hyderabad", "IIT, Hyderabad", "IITH"],
    "type": "IIT",
    "state": "Telangana",
    "city": "Hyderabad",
    "established": 2008,
    "nirf_rank": 8
  },
  {
    "id": "iit-jodhpur",
    "name": "Indian Institute of Technology Jodhpur",
    "aliases": ["IIT Jodhpur", "IIT, Jodhpur", "IITJ"],
    "type": "IIT",
    "state": "Rajasthan",
    "city": "Jodhpur",
    "established": 2008,
    "nirf_rank": 21
  },
  {
    "id": "iit-patna",
    "name": "Indian Institute of Technology Patna",
    "aliases": ["IIT Patna", "IIT, Patna", "IITP"],
    "type": "IIT",
    "state": "Bihar",
    "city": "Patna",
    "established": 2008,
    "nirf_rank": 26
  },
  {
    "id": "iit-ropar",
    "name": "Indian Institute of Technology Ropar",
    "aliases": ["IIT Ropar", "IIT, Ropar", "IITRPR"],
    "type": "IIT",
    "state": "Punjab",
    "city": "Rupnagar",
    "established": 2008,
    "nirf_rank": 22
  },
  {
    "id": "iit-indore",
    "name": "Indian Institute of Technology Indore",
    "aliases": ["IIT Indore", "IIT, Indore", "IITI"],
    "type": "IIT",
    "state": "Madhya Pradesh",
    "city": "Indore",
    "established": 2009,
    "nirf_rank": 14
  },
  {
    "id": "iit-mandi",
    "name": "Indian Institute of Technology Mandi",
    "aliases": ["IIT Mandi", "IIT, Mandi", "IITMandi"],
    "type": "IIT",
    "state": "Himachal Pradesh",
    "city": "Mandi",
    "established": 2009,
    "nirf_rank": 31
  },
  {
    "id": "iit-varanasi",
    "name": "Indian Institute of Technology (BHU) Varanasi",
    "aliases": [
      "IIT BHU",
      "IIT (BHU) Varanasi",
      "IIT Banaras",
      "IIT-BHU",
      "IIT BHU Varanasi",
      "Indian Institute of Technology (Banaras Hindu University) Varanasi"
    ],
    "type": "IIT",
    "state": "Uttar Pradesh",
    "city": "Varanasi",
    "established": 2012,
    "nirf_rank": 15
  },
  {
    "id": "iit-palakkad",
    "name": "Indian Institute of Technology Palakkad",
    "aliases": ["IIT Palakkad", "IIT, Palakkad", "IITPKD"],
    "type": "IIT",
    "state": "Kerala",
    "city": "Palakkad",
    "established": 2015,
    "nirf_rank": 58
  },
  {
    "id": "iit-tirupati",
    "name": "Indian Institute of Technology Tirupati",
    "aliases": ["IIT Tirupati", "IIT, Tirupati", "IITTP"],
    "type": "IIT",
    "state": "Andhra Pradesh",
    "city": "Tirupati",
    "established": 2015,
    "nirf_rank": 59
  },
  {
    "id": "iit-dhanbad",
    "name": "Indian Institute of Technology (ISM) Dhanbad",
    "aliases": [
      "IIT ISM Dhanbad",
      "IIT (ISM) Dhanbad",
      "ISM Dhanbad",
      "IITISM",
      "Indian School of Mines Dhanbad",
      "Indian School of Mines, Dhanbad",
      "Indian Institute of Technology (Indian School of Mines) Dhanbad",
      "Indian Institute of Technology (Indian School of Mines)"
    ],
    "type": "IIT",
    "state": "Jharkhand",
    "city": "Dhanbad",
    "established": 2016,
    "nirf_rank": 12
  },
  {
    "id": "iit-bhilai",
    "name": "Indian Institute of Technology Bhilai",
    "aliases": ["IIT Bhilai", "IIT, Bhilai", "IITBH"],
    "type": "IIT",
    "state": "Chhattisgarh",
    "city": "Bhilai",
    "established": 2016,
    "nirf_rank": 69
  },
  {
    "id": "iit-goa",
    "name": "Indian Institute of Technology Goa",
    "aliases": ["IIT Goa", "IIT, Goa", "IITGoa"],
    "type": "IIT",
    "state": "Goa",
    "city": "Ponda",
    "established": 2016,
    "nirf_rank": 78
  },
  {
    "id": "iit-jammu",
    "name": "Indian Institute of Technology Jammu",
    "aliases": ["IIT Jammu", "IIT, Jammu", "IITJMU"],
    "type": "IIT",
    "state": "Jammu and Kashmir",
    "city": "Jammu",
    "established": 2016,
    "nirf_rank": 51
  },
  {
    "id": "iit-dharwad",
    "name": "Indian Institute of Technology Dharwad",
    "aliases": ["IIT Dharwad", "IIT, Dharwad", "IITDH"],
    "type": "IIT",
    "state": "Karnataka",
    "city": "Dharwad",
    "established": 2016,
    "nirf_rank": 81
  },
  {
    "id": "nit-trichy",
    "name": "National Institute of Technology Tiruchirappalli",
    "aliases": [
      "NIT Trichy",
      "NIT Tiruchirappalli",
      "NITT",
      "REC Tiruchirappalli"
    ],
    "type": "NIT",
    "state": "Tamil Nadu",
    "city": "Tiruchirappalli",
    "established": 1964,
    "nirf_rank": 9
  },
  {
    "id": "nit-warangal",
    "name": "National Institute of Technology Warangal",
    "aliases": ["NIT Warangal", "NITW", "REC Warangal", "RECW"],
    "type": "NIT",
    "state": "Telangana",
    "city": "Warangal",
    "established": 1959,
    "nirf_rank": 19
  },
  {
    "id": "nit-surathkal",
    "name": "National Institute of Technology Karnataka, Surathkal",
    "aliases": [
      "NIT Surathkal",
      "NITK Surathkal",
      "NIT Karnataka",
      "NITK",
      "KREC Surathkal"
    ],
    "type": "NIT",
    "state": "Karnataka",
    "city": "Mangalore",
    "established": 1960,
    "nirf_rank": 17
  },
  {
    "id": "nit-rourkela",
    "name": "National Institute of Technology Rourkela",
    "aliases": ["NIT Rourkela", "NITRKL", "REC Rourkela"],
    "type": "NIT",
    "state": "Odisha",
    "city": "Rourkela",
    "established": 1961,
    "nirf_rank": 18
  },
  {
    "id": "nit-calicut",
    "name": "National Institute of Technology Calicut",
    "aliases": ["NIT Calicut", "NITC", "REC Calicut", "NIT Kozhikode"],
    "type": "NIT",
    "state": "Kerala",
    "city": "Kozhikode",
    "established": 1961,
    "nirf_rank": 25
  },
  {
    "id": "nit-durgapur",
    "name": "National Institute of Technology Durgapur",
    "aliases": ["NIT Durgapur", "NITDGP", "REC Durgapur"],
    "type": "NIT",
    "state": "West Bengal",
    "city": "Durgapur",
    "established": 1960,
    "nirf_rank": 43
  },
  {
    "id": "nit-silchar",
    "name": "National Institute of Technology Silchar",
    "aliases": ["NIT Silchar", "NITS", "REC Silchar"],
    "type": "NIT",
    "state": "Assam",
    "city": "Silchar",
    "established": 1967,
    "nirf_rank": 48
  },
  {
    "id": "nit-hamirpur",
    "name": "National Institute of Technology Hamirpur",
    "aliases": ["NIT Hamirpur", "NITH", "REC Hamirpur"],
    "type": "NIT",
    "state": "Himachal Pradesh",
    "city": "Hamirpur",
    "established": 1986,
    "nirf_rank": 71
  },
  {
    "id": "nit-jalandhar",
    "name": "Dr B R Ambedkar National Institute of Technology Jalandhar",
    "aliases": [
      "NIT Jalandhar",
      "Dr. B R Ambedkar NIT Jalandhar",
      "NITJ",
      "REC Jalandhar"
    ],
    "type": "NIT",
    "state": "Punjab",
    "city": "Jalandhar",
    "established": 1987,
    "nirf_rank": 46
  },
  {
    "id": "nit-kurukshetra",
    "name": "National Institute of Technology Kurukshetra",
    "aliases": ["NIT Kurukshetra", "NITKKR", "REC Kurukshetra"],
    "type": "NIT",
    "state": "Haryana",
    "city": "Kurukshetra",
    "established": 1963,
    "nirf_rank": 41
  },
  {
    "id": "nit-allahabad",
    "name": "Motilal Nehru National Institute of Technology Allahabad",
    "aliases": [
      "NIT Allahabad",
      "MNNIT Allahabad",
      "MNNIT",
      "MNREC Allahabad",
      "NIT Prayagraj"
    ],
    "type": "NIT",
    "state": "Uttar Pradesh",
    "city": "Prayagraj",
    "established": 1961,
    "nirf_rank": 56
  },
  {
    "id": "nit-bhopal",
    "name": "Maulana Azad National Institute of Technology Bhopal",
    "aliases": ["NIT Bhopal", "MANIT Bhopal", "MANIT", "MACT Bhopal"],
    "type": "NIT",
    "state": "Madhya Pradesh",
    "city": "Bhopal",
    "established": 1960,
    "nirf_rank": 65
  },
  {
    "id": "nit-nagpur",